{
  "result_schema_id": "urn:gdo:phase2-architecture-realignment-result:1.0.0",
  "result_contract_id": "GDO_PHASE2_ARCHITECTURE_REALIGNMENT_RESULT",
  "result_contract_version": "1.0.0",
  "result_id": "gdo-phase2-realignment:3ad518a0b1a784d19137868693a380e7d00c817ec188faf67d9718432cbe5549",
  "phase_id": "GDO_PHASE2",
  "previous_planning_q_id": "Q_AI-DEVELOPMENT-ORCHESTRATOR-PHASE2-PLANNING-001",
  "previous_planning_status": "SUPERSEDED_BEFORE_COMMIT",
  "previous_planning_commit_state": "NOT_COMMITTED",
  "new_mission": "INTENT_DRIVEN_LOCAL_AI_ASSISTED_DEVELOPMENT_ORCHESTRATION",
  "new_scope": "PHASE2_INTENT_DRIVEN_READ_ONLY_PROPOSAL_AND_CODEX_PACKAGE_ORCHESTRATION",
  "intent_sources": ["DIRECT_USER_INTENT", "NEWS_PROPOSAL", "REPOSITORY_FINDING", "REVIEW_FINDING", "EXTERNAL_RESEARCH_FINDING"],
  "first_implementation_q": "Q_AI-DEVELOPMENT-ORCHESTRATOR-PHASE2-INTENT-ENGINE-FOUNDATION-001",
  "sequence_count": 24,
  "news_proposal_adopted": true,
  "git_effect_repositioned": true,
  "schema_migration_executed": false,
  "registry_mutation_executed": false,
  "phase2_operational_implementation_started": false,
  "realignment_result": "PASS_WITH_WARNING"
}
